{
  "id": "7f8a9b0c-1d2e-4f3a-4b5c-7d8e9f0a1b2c",
  "type": "drt.requested",
  "source": "citizen-api",
  "time": "2025-01-15T17:45:02Z",
  "data": {
    "request_id": "f7a8b9c0-1d2e-4f3a-4b5c-7d8e9f0a1b2c",
    "user_sub": "citizen",
    "pickup": {
      "lat": 52.517,
      "lon": 13.3889
    },
    "dropoff": {
      "lat": 52.529,
      "lon": 13.4049
    },
    "requested_at": "2025-01-15T17:45:00Z",
    "passengers": 2
  }
}
